{
  "schema_version": 1,
  "format": "finite-goal-certificate-v1",
  "producer_status": "constructed_unverified",
  "goal_verified": false,
  "origin": "search",
  "goal_fingerprint": "e62b9555352b38526f92218ce02744a63f395b9beac0083ccfc5cbbdc9196cb4",
  "snapshot_id": "rewrite-formal-v1:976116cbe74135d49210c13db3d3d63d50fafc04473019fcd192356abb7ff589",
  "context_id": "search-neutral-context",
  "profile": "positive-facts-v1",
  "concrete_goal": {
    "schema_version": 1,
    "profile": "positive-facts-v1",
    "context_id": "search-neutral-context",
    "expected_type": {
      "kind": "Arrow",
      "from": {
        "kind": "Entity"
      },
      "to": {
        "kind": "Prop"
      }
    },
    "ports": [
      {
        "id": "x",
        "type": {
          "kind": "Entity"
        },
        "binding": {
          "kind": "Ref",
          "id": "B",
          "type": {
            "kind": "Entity"
          }
        }
      },
      {
        "id": "y",
        "type": {
          "kind": "Entity"
        }
      }
    ],
    "references": [
      {
        "id": "A",
        "type": {
          "kind": "Entity"
        }
      },
      {
        "id": "B",
        "type": {
          "kind": "Entity"
        }
      }
    ],
    "allowed_operators": [
      "relation",
      "join",
      "restrict",
      "bind",
      "permute",
      "project"
    ],
    "constraints": [
      {
        "id": "path01",
        "kind": "path",
        "symbol": "r",
        "from_port": "x",
        "to_port": "y",
        "from_role": "a",
        "to_role": "b",
        "allowed_atom_counts": [
          2
        ]
      },
      {
        "id": "property01",
        "kind": "unary",
        "symbol": "p",
        "port": "y"
      }
    ],
    "provenance": [
      {
        "id": "dse387-neutral",
        "uri": "https://github.com/clickbytes/golingua/issues/387",
        "version": "2026-10-26.1",
        "license": "internal-neutral-example",
        "author": "Codex by owner delegation"
      }
    ],
    "limits": {
      "max_atoms": 16,
      "max_steps": 64,
      "term_limits": {
        "max_nodes": 4096,
        "max_depth": 64,
        "max_type_depth": 32,
        "max_symbols": 512,
        "max_ports": 16
      }
    }
  },
  "choices": [
    {
      "kind": "path_signature",
      "axis_id": "axis-1",
      "constraint_id": "path01",
      "symbol": "r",
      "from_role": "a",
      "to_role": "b",
      "port_id": "x"
    },
    {
      "kind": "path_length",
      "axis_id": "axis-2",
      "constraint_id": "path01",
      "atom_count": 2
    },
    {
      "kind": "unary",
      "axis_id": "axis-3",
      "constraint_id": "property01",
      "symbol": "p",
      "port_id": "y",
      "unary_role": "v"
    },
    {
      "kind": "hole_binding",
      "axis_id": "axis-4",
      "port_id": "x",
      "hole_id": "H",
      "reference_id": "B"
    }
  ],
  "candidate_fingerprint": "sha256:9fce83fdf3e4e9a30852f5a69876270a102233dcecd76f07deea3890287f553c",
  "interface": [
    {
      "port": "y",
      "binder": "rel_r_b_1_fresh_2"
    }
  ],
  "operations": [
    {
      "id": "s1",
      "rule_id": "algebra.relation.v1",
      "op": "relation",
      "inputs": [],
      "symbol": "r",
      "mapping": [],
      "outputs": [],
      "ports": [
        "a",
        "b"
      ],
      "claimed_status": "ok",
      "checked_type": {
        "kind": "Arrow",
        "from": {
          "kind": "Entity"
        },
        "to": {
          "kind": "Arrow",
          "from": {
            "kind": "Entity"
          },
          "to": {
            "kind": "Prop"
          }
        }
      },
      "interface": [
        {
          "port": "a",
          "binder": "rel_r_a_1"
        },
        {
          "port": "b",
          "binder": "rel_r_b_1"
        }
      ],
      "substitutions": []
    },
    {
      "id": "s2",
      "rule_id": "algebra.relation.v1",
      "op": "relation",
      "inputs": [],
      "symbol": "r",
      "mapping": [],
      "outputs": [],
      "ports": [
        "a",
        "b"
      ],
      "claimed_status": "ok",
      "checked_type": {
        "kind": "Arrow",
        "from": {
          "kind": "Entity"
        },
        "to": {
          "kind": "Arrow",
          "from": {
            "kind": "Entity"
          },
          "to": {
            "kind": "Prop"
          }
        }
      },
      "interface": [
        {
          "port": "a",
          "binder": "rel_r_a_1"
        },
        {
          "port": "b",
          "binder": "rel_r_b_1"
        }
      ],
      "substitutions": []
    },
    {
      "id": "s3",
      "rule_id": "algebra.join.v1",
      "op": "join",
      "inputs": [
        "s1",
        "s2"
      ],
      "mapping": [
        {
          "left_port": "b",
          "right_port": "a"
        }
      ],
      "outputs": [
        {
          "side": "left",
          "port": "a",
          "as": "x"
        },
        {
          "side": "right",
          "port": "b",
          "as": "y"
        }
      ],
      "ports": [
        "x",
        "y"
      ],
      "claimed_status": "ok",
      "checked_type": {
        "kind": "Arrow",
        "from": {
          "kind": "Entity"
        },
        "to": {
          "kind": "Arrow",
          "from": {
            "kind": "Entity"
          },
          "to": {
            "kind": "Prop"
          }
        }
      },
      "interface": [
        {
          "port": "x",
          "binder": "rel_r_a_1_fresh_1"
        },
        {
          "port": "y",
          "binder": "rel_r_b_1_fresh_2"
        }
      ],
      "substitutions": []
    },
    {
      "id": "s4",
      "rule_id": "algebra.relation.v1",
      "op": "relation",
      "inputs": [],
      "symbol": "p",
      "mapping": [],
      "outputs": [],
      "ports": [
        "v"
      ],
      "claimed_status": "ok",
      "checked_type": {
        "kind": "Arrow",
        "from": {
          "kind": "Entity"
        },
        "to": {
          "kind": "Prop"
        }
      },
      "interface": [
        {
          "port": "v",
          "binder": "rel_p_v_1"
        }
      ],
      "substitutions": []
    },
    {
      "id": "s5",
      "rule_id": "algebra.restrict.v1",
      "op": "restrict",
      "inputs": [
        "s3",
        "s4"
      ],
      "symbol": "p",
      "mapping": [],
      "outputs": [],
      "port": "y",
      "ports": [
        "x",
        "y"
      ],
      "goal_port_id": "y",
      "claimed_status": "ok",
      "checked_type": {
        "kind": "Arrow",
        "from": {
          "kind": "Entity"
        },
        "to": {
          "kind": "Arrow",
          "from": {
            "kind": "Entity"
          },
          "to": {
            "kind": "Prop"
          }
        }
      },
      "interface": [
        {
          "port": "x",
          "binder": "rel_r_a_1_fresh_1"
        },
        {
          "port": "y",
          "binder": "rel_r_b_1_fresh_2"
        }
      ],
      "substitutions": []
    },
    {
      "id": "s6",
      "rule_id": "algebra.bind.v1",
      "op": "bind",
      "inputs": [
        "s5"
      ],
      "mapping": [],
      "outputs": [],
      "port": "x",
      "ports": [
        "y"
      ],
      "reference_id": "B",
      "goal_port_id": "x",
      "claimed_status": "ok",
      "checked_type": {
        "kind": "Arrow",
        "from": {
          "kind": "Entity"
        },
        "to": {
          "kind": "Prop"
        }
      },
      "interface": [
        {
          "port": "y",
          "binder": "rel_r_b_1_fresh_2"
        }
      ],
      "substitutions": [
        {
          "binder_id": "rel_r_a_1_fresh_1",
          "reference_id": "B",
          "type": {
            "kind": "Entity"
          }
        }
      ]
    }
  ],
  "scopes": [
    {
      "binder_id": "rel_r_b_1_fresh_2",
      "kind": "Lambda",
      "type": {
        "kind": "Entity"
      },
      "path": "expression"
    },
    {
      "binder_id": "join_0_1",
      "kind": "Exists",
      "type": {
        "kind": "Entity"
      },
      "path": "expression.body.operands[0]",
      "parent_binder_id": "rel_r_b_1_fresh_2"
    }
  ],
  "obligations": [
    {
      "constraint_id": "path01",
      "kind": "path",
      "status": "structural_claim",
      "step_ids": [],
      "fragments": [
        "candidate.expression.body.operands[0].body.operands[0]",
        "candidate.expression.body.operands[0].body.operands[1]"
      ]
    },
    {
      "constraint_id": "property01",
      "kind": "unary",
      "status": "structural_claim",
      "step_ids": [],
      "fragments": [
        "candidate.expression.body.operands[1]"
      ]
    }
  ],
  "assumptions": [
    {
      "kind": "typed_registry_snapshot",
      "value": "rewrite-formal-v1:976116cbe74135d49210c13db3d3d63d50fafc04473019fcd192356abb7ff589"
    },
    {
      "kind": "request_reference_boundary",
      "value": "sha256:b7364f53bc82faf85d55162efb7d7f3e2580ae37c1606649a4a95f3f8af68aef"
    },
    {
      "kind": "positive_structural_profile",
      "value": "positive-facts-v1"
    }
  ]
}
